data_source,title,brand,deal_price,list_price,multi_item_t_f,avg_rating,amount_rating,deal_start,deal_end,description
Rainforest API,Toshiba HD Smart Fire TVs Starting at $129.99 (32-inch to 43-inch),Best Buy,129.99 - 189.99,199.99 - 289.99,True,4.58,1009.0,2022-07-01T05:00:00.487Z,2022-07-14T06:55:00.487Z,0
Rainforest API,Insignia 4K Smart Fire TVs Starting at $189.99 (43-inch to 75-inch),Best Buy,189.99 - 599.99,299.99 - 849.99,True,4.6,4774.0,2022-07-01T05:00:00.487Z,2022-07-14T06:55:00.487Z,0
Rainforest API,Insignia HD Smart Fire TVs Starting at $89.99 (24-inch to 39-inch),Best Buy,89.99 - 149.99,169.99 - 229.99,True,4.52,26425.0,2022-07-01T05:00:00.487Z,2022-07-14T06:55:00.487Z,0
Rainforest API,Toshiba 4K Smart Fire TVs Starting at $229.99 (43-inch to 75-inch),Best Buy,229.99 - 699.99,329.99 - 1399.99,True,4.12,62.0,2022-07-01T05:00:00.487Z,2022-07-14T06:55:00.487Z,0
Rainforest API,Pioneer 4K Smart Fire TVs Starting at 199.99 (43-inch & 50-inch),Best Buy,199.99 - 249.99,319.99 - 419.99,True,4.64,488.0,2022-07-01T05:00:00.487Z,2022-07-14T06:55:00.487Z,0
Rainforest API,Insignia 42-inch Full HD Smart Fire TV,Best Buy,169.99,269.99,False,4.46,5010.0,2022-07-01T05:00:00.487Z,2022-07-14T06:55:00.487Z,0
Rainforest API,Toshiba 55-inch 4K UHD Smart Fire TV with Far Field Technology,Best Buy,349.99,799.99,False,4.12,62.0,2022-07-01T05:00:00.488Z,2022-07-14T06:55:00.488Z,0
Rainforest API,Insignia 32-inch HD Smart Fire TV,Best Buy,99.99,179.99,False,4.61,52455.0,2022-06-21T05:00:00.488Z,2022-07-14T06:55:00.488Z,0
Rainforest API,Amazon Fire TV 50-inch 4-Series 4K UHD Smart TV,Amazon.com,259.99,469.99,False,4.61,12335.0,2022-06-28T16:10:00.488Z,2022-07-11T18:55:00.488Z,Prime Members only and while supplies last. Valid only when shipped and sold by Amazon.com
Rainforest API,Up to 40% off Amazon Fire TV Omni Series 4K UHD Smart TVs,Amazon.com,299.99 - 749.99,409.99 - 1099.99,True,4.57,8706.0,2022-06-28T15:00:00.488Z,2022-07-05T14:55:00.488Z,Shipped and sold by Amazon.com
Rainforest API,Amazon Fire TV 43-inch 4-Series 4K UHD Smart TV,Amazon.com,199.99,369.99,False,4.61,12335.0,2022-06-28T16:10:00.488Z,2022-07-11T18:55:00.488Z,Prime Members only and while supplies last. Valid only when shipped and sold by Amazon.com
Rainforest API,Amazon Fire TV 55-inch Omni Series 4K UHD Smart TV,Amazon.com,299.99,559.99,False,4.57,8706.0,2022-06-28T16:10:00.489Z,2022-07-11T18:55:00.489Z,Prime Members only and while supplies last. Valid only when shipped and sold by Amazon.com
Rainforest API,Amazon Fire TV 55-inch 4-Series 4K UHD Smart TV,Amazon.com,349.99,519.99,False,4.61,12335.0,2022-06-28T15:00:00.489Z,2022-07-05T14:55:00.489Z,Shipped and sold by Amazon.com
Rainforest API,Sony 65 Inch A80K 4K Ultra HD BRAVIA XR OLED Smart Google TV ,Amazon.com,1998,2299.99,False,5.0,4.0,2022-07-04T07:00:00.489Z,2022-07-18T06:59:59.489Z,On sale for limited time only. Valid while supplies last and when shipped & sold by Amazon.com.
Rainforest API,Sony 55 inch A80J XR OLED 4K Ultra HD Smart Google TV ,Amazon.com,998,1899.99,False,4.7,1480.0,2022-07-01T07:00:00.489Z,2022-07-18T06:59:59.489Z,On sale for limited time only. Valid while supplies last and when shipped & sold by Amazon.com.
Rainforest API,Certified Refurbished Fire TV Stick with Alexa Voice Remote,Amazon.com,15.99,34.99,False,2.79,17.0,2022-07-02T07:00:00.489Z,2022-07-14T06:59:59.489Z,While supplies last. Valid only when shipped and sold by Amazon.com
Rainforest API,Certified Refurbished Fire TV Stick 4K with Alexa Voice Remote,Amazon.com,22.49,44.99,True,4.6,22071.0,2022-07-02T07:00:00.489Z,2022-07-14T06:59:59.489Z,While supplies last. Valid only when shipped and sold by Amazon.com
Rainforest API,VEVOR branded products,Amazon.com,42.83 - 1020.45,49.99 - 1299.99,True,5.0,7.0,2022-07-04T07:00:00.489Z,2022-07-12T06:59:59.489Z,While supplies last. Valid only when shipped and sold by Amazon.com
Rainforest API,Hisense Fire TV,Amazon.com,399.99,529.99,False,3.82,15.0,2022-06-17T07:00:00.489Z,2022-07-12T06:59:59.489Z,On sale for a limited time only. Offer valid while supplies last and when shipped from and sold by Amazon.com
Rainforest API,"Inflatable Movie Screen Outdoor, OUTTOY Inflatable Projection Screen with Quiet Fan and Storage Bag, Easy Set up, Mega Blow Up Screen for Backyard Movie Night, Theme Parties, Celebrations",Outtoy,110.49 - 118.99,199.99 - 229.99,True,4.55,977.0,2022-07-04T07:00:00.489Z,2022-07-11T06:45:00.489Z,"Inflatable Movie Screen Outdoor, OUTTOY Inflatable Projection Screen with Quiet Fan and Storage Bag, Easy Set up, Mega Blow Up Screen for Backyard Movie Night, Theme Parties, Celebrations"
Rainforest API,"Mounting Dream Full Motion TV Wall Mount Swivel and Tilt for Most 42-75 Inch Flat Screen TV, UL listed TV Mount Bracket with Articulating Dual Arms, Max VESA 600x400mm, 100 lbs, Fits 16"" Studs, MD2617",Mounting Dream,46.74,62.79,False,4.76,5988.0,2022-07-04T07:00:00.489Z,2022-07-11T06:45:00.489Z,"Mounting Dream Full Motion TV Wall Mount Swivel and Tilt for Most 42-75 Inch Flat Screen TV, UL listed TV Mount Bracket with Articulating Dual Arms, Max VESA 600x400mm, 100 lbs, Fits 16"" Studs, MD2617"
Rainforest API,"Certified Refurbished Fire TV Cube with Alexa 4K Ultra HD, streaming media player",Amazon.com,49.99,99.99,False,4.54,1947.0,2022-07-02T07:00:00.490Z,2022-07-14T06:59:59.490Z,While supplies last. Valid only when shipped and sold by Amazon.com
Rainforest API,"Pipishell TV Wall Mount for 26-55 inch TVs, Full Motion TV Mount Bracket with Articulating Swivel Extension Tilting Leveling Max VESA 400x400mm Holds up to 99lbs for LED LCD OLED 4K Flat Curved Screen",Pipishell,36.54,49.99,False,4.75,472.0,2022-07-04T07:00:00.490Z,2022-07-11T06:45:00.490Z,"Pipishell TV Wall Mount for 26-55 inch TVs, Full Motion TV Mount Bracket with Articulating Swivel Extension Tilting Leveling Max VESA 400x400mm Holds up to 99lbs for LED LCD OLED 4K Flat Curved Screen"
Rainforest API,"VIVOHOME 80"" 100"" 120"" Manual Pull Down Projector Screen for Movie Home Theater Cinema Office Video Game",VIVOHOME,74.79 - 84.99,99.99 - 129.99,True,4.56,1307.0,2022-07-04T07:00:00.490Z,2022-07-11T06:45:00.490Z,"VIVOHOME 80"" 100"" 120"" Manual Pull Down Projector Screen for Movie Home Theater Cinema Office Video Game"
Rainforest API,"MEGATEK Multi-Region DVD Player for TV with HDMI (1080p Upscaling), CD Player for Home, USB Port, Coaxial Digital Out, Compact Design with Durable Metal Housing, with Remote & 5ft HDMI Cable",Megatek Electronics,33.95,44.99,False,4.27,7975.0,2022-07-04T07:00:00.490Z,2022-07-11T06:45:00.490Z,"MEGATEK Multi-Region DVD Player for TV with HDMI (1080p Upscaling), CD Player for Home, USB Port, Coaxial Digital Out, Compact Design with Durable Metal Housing, with Remote & 5ft HDMI Cable"
Rainforest API,MOUNTUP TV Wall Mount for Most 30-55 inch Flat/Curved TVs,MOUNTUP,19.99 - 25.49,35.99 - 39.99,True,4.7,3328.0,2022-07-04T07:00:00.490Z,2022-07-11T06:45:00.490Z,MOUNTUP TV Wall Mount for Most 30-55 inch Flat/Curved TVs
Rainforest API,"Full Motion TV Wall Mount for 23-55 Inch Flat Curved TVs with Swivel Articulating Extends Tilt Arm, Single Stud Perfect Center Design TV Bracket Max VESA 400x400mm up to 88lbs by Perlegear, PGMF5",Perlegear,19.04,39.96,False,4.68,2792.0,2022-07-04T07:00:00.490Z,2022-07-11T06:45:00.490Z,"Full Motion TV Wall Mount for 23-55 Inch Flat Curved TVs with Swivel Articulating Extends Tilt Arm, Single Stud Perfect Center Design TV Bracket Max VESA 400x400mm up to 88lbs by Perlegear, PGMF5"
Rainforest API,"DVD Player,Foramor HDMI DVD Player for Smart TV Support 1080P Full HD with HDMI Cable Remote Control USB Input Region Free Home DVD Players",Seewon-US,25.49,45.99,False,4.26,4140.0,2022-07-04T07:00:00.490Z,2022-07-11T06:45:00.490Z,"DVD Player,Foramor HDMI DVD Player for Smart TV Support 1080P Full HD with HDMI Cable Remote Control USB Input Region Free Home DVD Players"
Rainforest API,"Save on VEVOR Projector Screen, 110"" 16:9 4K/8K Ultra HDR, Pull Up Projector Screen, Portable Floor-Rising Projection Screen, Indoor Outdoor Movie Screen w/ Storage Bag for Home Backyard Theater Office and more",Amazon.com,45.35 - 526.49,55.99 - 649.99,True,0.0,0.0,2022-07-01T07:00:00.490Z,2022-07-15T07:00:00.489Z,"Save on VEVOR Projector Screen, 110"" 16:9 4K/8K Ultra HDR, Pull Up Projector Screen, Portable Floor-Rising Projection Screen, Indoor Outdoor Movie Screen w/ Storage Bag for Home Backyard Theater Office and more"
Rainforest API,"Cleaner Kit for Airpod,Supfine Airpods Pro Cleaning Pen,Multi-Function Cleaner Kit Soft Brush for Phone Charging Port,Earbuds,Earpods,Earphone,Headphone, iPod,Case,iPhone,ipad,Laptop(White)",wawowa,8.49,19.99,False,4.22,69.0,2022-07-04T07:00:00.490Z,2022-07-11T06:45:00.490Z,"Cleaner Kit for Airpod,Supfine Airpods Pro Cleaning Pen,Multi-Function Cleaner Kit Soft Brush for Phone Charging Port,Earbuds,Earpods,Earphone,Headphone, iPod,Case,iPhone,ipad,Laptop(White)"
Rainforest API,Projector Screen 120 inch with Frame 16:9 HD 4K Movies Screen Portable Widescreen Foldable Anti-Crease Indoor Outdoor Projection Movies Screen for Home Theater Match Party,HOIN,39.94,59.99,False,4.04,155.0,2022-07-04T07:00:00.490Z,2022-07-11T06:45:00.490Z,Projector Screen 120 inch with Frame 16:9 HD 4K Movies Screen Portable Widescreen Foldable Anti-Crease Indoor Outdoor Projection Movies Screen for Home Theater Match Party
Rainforest API,"Mounting Dream Tilting TV Mounts for Most 26-55 Inch LED, LCD TVs up to VESA 400 x 400mm and 88 LBS Loading Capacity, TV Wall Mount with Unique Strap Design for Easily Lock and Release MD2268-MK",Mounting Dream,18.69,29.99,False,4.7,15827.0,2022-07-04T07:00:00.490Z,2022-07-11T06:45:00.490Z,"Mounting Dream Tilting TV Mounts for Most 26-55 Inch LED, LCD TVs up to VESA 400 x 400mm and 88 LBS Loading Capacity, TV Wall Mount with Unique Strap Design for Easily Lock and Release MD2268-MK"
Rainforest API,Prime members save on Fire TV Gaming Bundle with Fire TV Stick 4K Max and Luna Controller,Amazon.com,,,True,0.0,0.0,2022-06-21T05:00:00.490Z,2022-07-05T14:55:00.490Z,While supplies last. Valid only when shipped and sold by Amazon.com.
Rainforest API,Prime members save on Fire TV Gaming Bundle including Fire TV Stick 4K and Luna Controller,Amazon.com,,,True,0.0,0.0,2022-06-21T05:00:00.490Z,2022-07-05T14:55:00.490Z,While supplies last. Valid only when shipped and sold by Amazon.com.
Rainforest API,Sony BDP-S6700 4K Upscaling 3D Streaming Home Theater Blu-Ray Disc Player,Amazon.com,,,True,0.0,0.0,2022-06-30T07:00:00.490Z,2022-07-18T06:59:59.490Z,On sale for limited time only. Valid while supplies last and when shipped & sold by Amazon.com.
Rainforest API,Sony 55 Inch X85K 4K Ultra HD LED Smart Google TV Dolby Vision HDR ,Amazon.com,,,True,0.0,0.0,2022-06-30T07:00:00.490Z,2022-07-18T06:59:59.490Z,On sale for limited time only. Valid while supplies last and when shipped & sold by Amazon.com.
Rainforest API,Sony 55 Inch X90K 4K Ultra HD BRAVIA XR Full Array LED Smart TV ,Amazon.com,,,True,0.0,0.0,2022-06-30T07:00:00.490Z,2022-07-18T06:59:59.490Z,On sale for limited time only. Valid while supplies last and when shipped & sold by Amazon.com.
Rainforest API,"PERLESMITH TV Wall Mount Full Motion for 32-55 Inch Flat Curved Screen TVs, TV Mount with Swivels Tilts Extension Dual Articulating Bracket Arms Supports TV up to 99 lbs Max VESA 400x400,PSMFK9",PERLESMITH,33.99,49.99,False,4.73,115.0,2022-07-04T07:00:00.491Z,2022-07-11T06:45:00.491Z,"PERLESMITH TV Wall Mount Full Motion for 32-55 Inch Flat Curved Screen TVs, TV Mount with Swivels Tilts Extension Dual Articulating Bracket Arms Supports TV up to 99 lbs Max VESA 400x400,PSMFK9"
Rainforest API,Suptek TV Wall Mount,Suptek,10.89,19.99,False,4.57,2841.0,2022-07-04T07:00:00.491Z,2022-07-11T06:45:00.491Z,Suptek TV Wall Mount
Rainforest API,"Suptek Adjustable TV Wall Mount Swivel and Tilt TV Arm Bracket for Most 32-55 inch LED, LCD Monitor and Plasma TVs up to 70lbs VESA up to 400x400mm (MAFD-L400)",YB-US,16.99,,False,4.65,7170.0,2022-07-04T07:00:00.491Z,2022-07-11T06:45:00.491Z,"Suptek Adjustable TV Wall Mount Swivel and Tilt TV Arm Bracket for Most 32-55 inch LED, LCD Monitor and Plasma TVs up to 70lbs VESA up to 400x400mm (MAFD-L400)"
Rainforest API,"Universal TV Stand Table Top for 27 to 85 Inch LED LCD Flat Screen TV, Height Adjustable Leg Stand Holds up to 110lbs, VESA up to 1000x800mm (ML2785)",YB-US,16.14 - 21.24,29.99,True,4.38,2536.0,2022-07-04T07:00:00.491Z,2022-07-11T06:45:00.491Z,"Universal TV Stand Table Top for 27 to 85 Inch LED LCD Flat Screen TV, Height Adjustable Leg Stand Holds up to 110lbs, VESA up to 1000x800mm (ML2785)"
Rainforest API,Electronics and Accessories,Amazon.com,12.1 - 175.1,13.99 - 449,True,4.48,3124.0,2022-07-04T07:00:00.491Z,2022-07-17T07:00:00.491Z,Electronics and Accessories are on sale for limited time only. Valid while supplies last and when shipped & sold by Amazon.com. Discount reflected in current price.
Rainforest API,Japard TV Wall Mount Bracket Low Profile for 12-24 Inch Flat,Japard,6.99,12.99,False,0.0,0.0,2022-07-02T17:00:00.491Z,2022-07-16T17:00:00.491Z,Japard TV Wall Mount Bracket Low Profile for 12-24 Inch Flat
Rainforest API,VIVOHOME Indoor and Outdoor Inflatable Blow up Mega Movie Projector Screen with Carry Bag for Front and Rear Projection,VIVOHOME,135.99 - 237.99,199.99,True,4.42,219.0,2022-07-04T07:00:00.491Z,2022-07-11T06:45:00.491Z,VIVOHOME Indoor and Outdoor Inflatable Blow up Mega Movie Projector Screen with Carry Bag for Front and Rear Projection
Rainforest API,Sony 85 Inch X80K 4K Ultra HD TV LED Smart Google TV ,Amazon.com,1798,2299.99,False,4.44,111.0,2022-07-04T07:00:00.491Z,2022-07-18T06:59:59.491Z,On sale for limited time only. Valid while supplies last and when shipped & sold by Amazon.com.
Rainforest API,"Sanus Full Motion TV Wall Mount for 13""-32"" LED, LCD and Plasma Flat Screen TVs and Monitors - Extends 7 Inches - MSF07C-B1 Black",Amazon.com,46.49,59.99,False,4.07,49.0,2022-07-01T10:00:00.491Z,2022-07-15T06:59:59.491Z,"Sanus Full Motion TV Wall Mount for 13""-32"" LED, LCD and Plasma Flat Screen TVs and Monitors - Extends 7 Inches - MSF07C-B1 Black"
Rainforest API,"FORGING MOUNT Long Extension TV Mount Corner Wall Mount TV Bracket Full Motion with 30 inch Long Arm for Corner/Flat Installation fits 37 to 75"" Flat/Curve TVs, VESA 600x400mm Holds up to 99lbs",HY bracket,67.91,119.99,False,4.76,2239.0,2022-07-04T07:00:00.491Z,2022-07-11T06:45:00.491Z,"FORGING MOUNT Long Extension TV Mount Corner Wall Mount TV Bracket Full Motion with 30 inch Long Arm for Corner/Flat Installation fits 37 to 75"" Flat/Curve TVs, VESA 600x400mm Holds up to 99lbs"
Rainforest API,Up to 35% discount from Sewinfla,Sewinfla,102.89 - 300.99,329.99,True,4.57,595.0,2022-06-25T17:00:00.491Z,2022-07-09T17:00:00.491Z,Up to 35% discount from Sewinfla
Rainforest API,"BLUE STONE Full Motion TV Wall Mount Bracket for Most 32-70 Inch TVs with Articulating Arms Swivels Tilts Extension Rotation, up to VESA 400X400mm, 121 lbs",Winstone-US,35.69,41.99,False,4.67,56.0,2022-07-04T07:00:00.491Z,2022-07-11T06:45:00.491Z,"BLUE STONE Full Motion TV Wall Mount Bracket for Most 32-70 Inch TVs with Articulating Arms Swivels Tilts Extension Rotation, up to VESA 400X400mm, 121 lbs"
Rainforest API,"16 Feet Inflatable Outdoor and Indoor Theater Projector Screen - Includes Inflation Fan, Tie-Downs and Storage Bag - Only Supports Front Projection (16FT)",NOELEN GAD,104.99,169.99,False,4.57,309.0,2022-07-04T07:00:00.492Z,2022-07-11T06:45:00.492Z,"16 Feet Inflatable Outdoor and Indoor Theater Projector Screen - Includes Inflation Fan, Tie-Downs and Storage Bag - Only Supports Front Projection (16FT)"
Rainforest API,Projector Screen with Stand 120 inch Outdoor Indoor Projector Screen 16:9 4K HD Portable Rear Front Projection Movie Screen with Carry Bag for Home Theater Backyard Movie Night,AZXRHWYGS,65.44,129.99,False,4.32,41.0,2022-07-04T07:00:00.492Z,2022-07-11T06:45:00.492Z,Projector Screen with Stand 120 inch Outdoor Indoor Projector Screen 16:9 4K HD Portable Rear Front Projection Movie Screen with Carry Bag for Home Theater Backyard Movie Night
Rainforest API,"Full Motion TV Wall Mounts with Height Adjustment，Dual Articulating Arms Swivel and Tilt for 32-70 Inch LED LCD Flat&Curved TV, TV Wall Mount Bracket for Max VESA 400x400mm and Holds Up to 121 lbs",TIPTOPONE,33.69,49.99,False,4.72,609.0,2022-07-04T07:00:00.492Z,2022-07-11T06:45:00.492Z,"Full Motion TV Wall Mounts with Height Adjustment，Dual Articulating Arms Swivel and Tilt for 32-70 Inch LED LCD Flat&Curved TV, TV Wall Mount Bracket for Max VESA 400x400mm and Holds Up to 121 lbs"
Rainforest API,Sony 55 Inch A80K 4K Ultra HD BRAVIA XR OLED Smart Google TV,Amazon.com,1698,1999.99,False,5.0,4.0,2022-07-04T07:00:00.492Z,2022-07-11T06:59:59.492Z,On sale for limited time only. Valid while supplies last and when shipped & sold by Amazon.com.
Rainforest API,Sony 65 Inch X90K 4K Ultra HD Smart Google TV Exclusive Features for The Playstation,Amazon.com,1298,1499.99,False,3.55,15.0,2022-06-27T07:00:00.492Z,2022-07-18T06:59:59.492Z,On sale for limited time only. Valid while supplies last and when shipped & sold by Amazon.com.
Rainforest API,Electronics Accessories & Supplies,Amazon.com,8.6 - 71.5,10.99 - 142.4,True,4.73,403.0,2022-07-03T07:00:00.492Z,2022-07-09T07:00:00.492Z,Electronics Accessories & Supplies are on sale for limited time only. Valid while supplies last and when shipped & sold by Amazon.com. Discount reflected in current price.
Rainforest API,"KDG Full Motion TV Wall Mount with Height Setting, TV Mount Bracket for Most 32-65 Inch LED LCD 4K Flat Screen Curved TV, Articulating Swivel Tilt Extension Max VESA 400x400mm Loading up to 121lbs",APEXSTONE,35.69,,False,4.66,679.0,2022-07-04T07:00:00.492Z,2022-07-11T06:45:00.492Z,"KDG Full Motion TV Wall Mount with Height Setting, TV Mount Bracket for Most 32-65 Inch LED LCD 4K Flat Screen Curved TV, Articulating Swivel Tilt Extension Max VESA 400x400mm Loading up to 121lbs"
Rainforest API,LG 86NANO90UPA Alexa Built-In NanoCell 90 Series 86 inch 4K Smart UHD NanoCell TV,Amazon.com,1796.99,2699.99,False,4.59,463.0,2022-06-13T07:00:00.492Z,2022-07-18T06:59:59.492Z,"LG 86NANO90UPA Alexa Built-In NanoCell 90 Series 86"" 4K Smart UHD NanoCell TV"
Rainforest API,"Ceiling TV Mount,BLUE STONE Adjustable Height Telescoping Tilt and Swivel,Fits Most 28-55"" LCD LED Plasma Monitor Flat Panel Screen Display (28-55"")",APEXSTONE,33.99,46.99,False,4.68,49.0,2022-07-04T07:00:00.492Z,2022-07-11T06:45:00.492Z,"Ceiling TV Mount,BLUE STONE Adjustable Height Telescoping Tilt and Swivel,Fits Most 28-55"" LCD LED Plasma Monitor Flat Panel Screen Display (28-55"")"
Rainforest API,"ELIVED UL Listed Full Motion TV Monitor Wall Mount for Most 14-42 Inch LED LCD Flat Screen TVs & Monitors, Swivels Tilts Extension Rotation, Max VESA 200x200mm, up to 33 lbs",Elived Store,38.24 - 44.19,59.99,True,4.52,1555.0,2022-07-04T07:00:00.492Z,2022-07-11T06:45:00.492Z,"ELIVED UL Listed Full Motion TV Monitor Wall Mount for Most 14-42 Inch LED LCD Flat Screen TVs & Monitors, Swivels Tilts Extension Rotation, Max VESA 200x200mm, up to 33 lbs"
Rainforest API,"Chainstone Full Motion TV Wall Mount Monitor Wall Bracket for Most 28-60 Inch LED LCD OLED 4K TVs, Articulating Arms Swivel Tilt Extension Rotation Easy Center TV Mounts, Max VESA 400x400mm up 80 lbs",Modaxi-US,23.79,31.99,False,4.17,20.0,2022-07-04T07:00:00.492Z,2022-07-11T06:45:00.492Z,"Chainstone Full Motion TV Wall Mount Monitor Wall Bracket for Most 28-60 Inch LED LCD OLED 4K TVs, Articulating Arms Swivel Tilt Extension Rotation Easy Center TV Mounts, Max VESA 400x400mm up 80 lbs"
Rainforest API,"USB Microphone Podcast Recording Kit - Audio Cardioid Condenser Mic w/Desktop Stand and Pop Filter - for Gaming PS4, Streaming, Podcasting, Studio, YouTube, Works w/Windows Mac PC - Pyle PDMIKT120",Amazon.com,49.44,68.99,False,4.43,947.0,2022-06-28T11:00:00.512Z,2022-07-12T06:59:59.512Z,"USB Microphone Podcast Recording Kit - Audio Cardioid Condenser Mic w/Desktop Stand and Pop Filter - for Gaming PS4, Streaming, Podcasting, Studio, YouTube, Works w/Windows Mac PC - Pyle PDMIKT120"
Rainforest API,"WEMAX Projector Screen, Ambient Light Rejecting (ALR) Projection Screen for UST Ultra Short Throw Projection, Edge Free Fixed Frame Screen",WEMAX,424.99,699.99,False,3.68,15.0,2022-07-04T07:00:00.512Z,2022-07-11T06:45:00.512Z,"WEMAX Projector Screen, Ambient Light Rejecting (ALR) Projection Screen for UST Ultra Short Throw Projection, Edge Free Fixed Frame Screen"
Rainforest API,"JUSTSTONE Tilt TV Wall Mount Bracket for 40-90 Inches LED, Plasma Flat Screen Curved TVs, TV Mount with VESA 600x400mm, Fits 16"" to 24"" Studs and Loading Capacity 165 lbs, Low Profile and Space Save",JStone,31.44,39.99,False,4.63,2756.0,2022-07-04T07:00:00.512Z,2022-07-11T06:45:00.512Z,"JUSTSTONE Tilt TV Wall Mount Bracket for 40-90 Inches LED, Plasma Flat Screen Curved TVs, TV Mount with VESA 600x400mm, Fits 16"" to 24"" Studs and Loading Capacity 165 lbs, Low Profile and Space Save"
Rainforest API,"Full Motion TV Wall Mount for 32-70 Inch Flat&Curved TV, KDG TV Mount Bracket Dual Swivel Articulating Extension Tilt Arms with VESA 400x400mm Up to 121lbs",winstone ergonomic,33.99,59.99,False,4.66,124.0,2022-07-04T07:00:00.512Z,2022-07-11T06:45:00.512Z,"Full Motion TV Wall Mount for 32-70 Inch Flat&Curved TV, KDG TV Mount Bracket Dual Swivel Articulating Extension Tilt Arms with VESA 400x400mm Up to 121lbs"
Rainforest API,WALI Universal TV Stand Table Top for Flat Screen TV,Wali Electric,12.18 - 15.29,24.99,True,4.41,1656.0,2022-07-04T07:00:00.512Z,2022-07-11T06:45:00.512Z,WALI Universal TV Stand Table Top for Flat Screen TV
Rainforest API,Sony 65 inch X95J XR Full Array LED 4K Ultra HD Smart Google TV,Amazon.com,1298,1999.99,False,4.52,123.0,2022-07-04T07:00:00.512Z,2022-07-18T06:59:59.512Z,On sale for limited time only. Valid while supplies last and when shipped & sold by Amazon.com.
Rainforest API,"TransDeco TV stand with mount for 35-80 inch television, Espresso/Black",Amazon.com,337.84,479.95,False,4.34,218.0,2022-06-23T13:00:00.512Z,2022-07-07T06:59:59.512Z,"TransDeco TV stand with mount for 35-80 inch television, Espresso/Black"
Rainforest API,"Save on TV Wall Mount, Full Motion TV Wall Mount for Most 13-55 Inch LED LCD Flat Curved Screen TVs, Swivel Extension Articulating Rotation TV Mount Bracket with Max VESA 400x400mm and Holds up to 66lbs and more",Amazon.com,18.64 - 22.79,25.99 - 31.99,True,4.62,1710.0,2022-07-01T07:00:00.513Z,2022-07-11T07:00:00.512Z,"Save on TV Wall Mount, Full Motion TV Wall Mount for Most 13-55 Inch LED LCD Flat Curved Screen TVs, Swivel Extension Articulating Rotation TV Mount Bracket with Max VESA 400x400mm and Holds up to 66lbs and more"
Rainforest API,Electronics and Accessories,Amazon.com,6.9 - 254.1,18.99 - 449,True,4.25,597.0,2022-07-03T07:00:00.513Z,2022-07-09T07:00:00.513Z,Electronics and Accessories are on sale for limited time only. Valid while supplies last and when shipped & sold by Amazon.com. Discount reflected in current price.
Rainforest API,Sony UBP- X700M 4K Ultra HD Home Theater Streaming Blu-ray™ Player ,Amazon.com,248,329.99,False,4.5,1958.0,2022-07-04T07:00:00.513Z,2022-07-18T06:59:59.513Z,On sale for limited time only. Valid while supplies last and when shipped & sold by Amazon.com
Rainforest API,Up to 30% off Electronics from ERGOJOY,ERGOJOY,32.19 - 86.79,50.99 - 139.99,True,5.0,2.0,2022-06-29T05:00:00.513Z,2022-07-13T05:00:00.513Z,Up to 30% off Electronics from ERGOJOY
Rainforest API,Suptek TV Wall Mount A1 Series,Suptek,16.99,29.99,False,4.54,1555.0,2022-07-04T07:00:00.513Z,2022-07-11T06:45:00.513Z,Suptek TV Wall Mount A1 Series
Rainforest API,Up to 30% discount from AC Doctor INC,AC Doctor INC,17.5 - 23.22,44.26 - 50.82,True,5.0,4.0,2022-07-02T17:00:00.513Z,2022-07-16T17:00:00.513Z,Up to 30% discount from AC Doctor INC
Rainforest API,Projector Screen and Stand CENTURY-STAR 16:9 4K 3D Front Rear Anti-Crease Outdoor Projection Screen Portable Movie Screen with Carry Bag,QIFUTONG,90.09 - 91.79,,True,4.47,68.0,2022-07-04T07:00:00.513Z,2022-07-11T06:45:00.513Z,Projector Screen and Stand CENTURY-STAR 16:9 4K 3D Front Rear Anti-Crease Outdoor Projection Screen Portable Movie Screen with Carry Bag
Rainforest API,Deals from YJY SHOP,YJY SHOP,9.09 - 18.19,,True,4.52,38.0,2022-06-29T05:00:00.513Z,2022-07-13T05:00:00.513Z,Deals from YJY SHOP
Rainforest API,WEWATCH Projector Screen,WEWATCH,16.99 - 18.69,29.99 - 39.99,True,4.14,141.0,2022-07-04T07:00:00.513Z,2022-07-11T06:45:00.513Z,WEWATCH Projector Screen
Rainforest API,Sony 50 Inch X90J XR Full Array LED 4K Ultra HD Smart Google TV,Amazon.com,898,999.99,False,4.6,1966.0,2022-06-20T07:00:00.513Z,2022-07-18T06:59:59.513Z,On sale for limited time only. Valid while supplies last and when shipped & sold by Amazon.com.
Rainforest API,Wall Mount Compatible with Apple TV 4K 5th and 4th Generatio,Yibracki,9.99,14.99,False,4.53,17.0,2022-06-29T05:00:00.513Z,2022-07-13T05:00:00.513Z,Wall Mount Compatible with Apple TV 4K 5th and 4th Generatio
Rainforest API,Up to 30% off Electronics from SDUSEIO,SDUSEIO,8.39 - 9.79,,True,4.21,800.0,2022-06-25T17:00:00.513Z,2022-07-09T17:00:00.513Z,Up to 30% off Electronics from SDUSEIO
Rainforest API,LG 75-inch TVs,Amazon.com,799.99,1499.99,True,4.55,6214.0,2022-07-04T07:00:00.513Z,2022-07-18T06:59:59.513Z,On sale for limited time only. Valid while supplies last and when shipped & sold by Amazon.com. Discount reflected in current price.
Rainforest API,Delidigi HomePod Mini Wall Mount Stable Bracket Holder Shelf,Delidigi,9.09,,False,4.44,234.0,2022-07-02T17:00:00.513Z,2022-07-16T17:00:00.513Z,Delidigi HomePod Mini Wall Mount Stable Bracket Holder Shelf
Rainforest API,Computer Accessories,Amazon.com,9.3 - 206.9,14.99 - 389,True,5.0,2.0,2022-07-03T07:00:00.513Z,2022-07-09T07:00:00.513Z,Computer Accessories are on sale for limited time only. Valid while supplies last and when shipped & sold by Amazon.com. Discount reflected in current price.
